{
  "executive": {
    "counts": {
      "programas": 9,
      "forms": 4,
      "funciones": 94,
      "reports": 17,
      "lineas_totales": 8098,
      "ncloc": 6258,
      "complejidad": 771,
      "god_modules": 5,
      "menus": 4,
      "opciones_menu": 13,
      "pantallas": 5,
      "privilegios_sca": 15,
      "casos_de_uso": 8,
      "reglas_negocio": 21,
      "stored_procedures": 8,
      "comandos_shell": 53,
      "includes_globals": 2,
      "sast_findings": 30,
      "sast_confirmados": 8,
      "sast_high": 19,
      "sast_high_confirmados": 5,
      "sast_latentes": 15,
      "sast_refutados": 7,
      "cves_dependencia": "N/A",
      "provenance": {
        "programas": "inventory.counts.programs",
        "forms": "inventory.counts.forms",
        "funciones": "inventory.counts.functions",
        "reports": "inventory.counts.reports",
        "lineas_totales": "inventory.counts.lines_total",
        "ncloc": "quality.measures.ncloc",
        "complejidad": "quality.measures.complexity",
        "god_modules": "len(quality.god_classes)",
        "menus": "inventory.counts.menus",
        "opciones_menu": "len(functional.options) — inventory.counts.menu_commands=12 cuenta solo COMMAND clásicos; el COMMAND KEY(\"L\") de EXCC001.4gl:240 suma la 13a opción (nota en functional.menu_source)",
        "pantallas": "len(functional.screens)",
        "privilegios_sca": "len(functional.privileges)",
        "casos_de_uso": "len(usecases.usecases)",
        "reglas_negocio": "len(br.rules)",
        "stored_procedures": "len(modules4gl.counts.stored_procedures)",
        "comandos_shell": "modules4gl.counts.shell_commands",
        "includes_globals": "modules4gl.counts.includes",
        "sast_findings": "len(sast.findings)",
        "sast_confirmados": "len([f in sast.findings | status=confirmed])",
        "sast_high": "len([f in sast.findings | severity=HIGH])",
        "sast_high_confirmados": "len([f in sast.findings | severity=HIGH y status=confirmed])",
        "sast_latentes": "len([f in sast.findings | status=latent])",
        "sast_refutados": "len([f in sast.findings | status=refuted])",
        "cves_dependencia": "fact vulnerabilities inexistente — CVE-por-dependencia N/A para core 4GL sin librerías terceras empaquetadas (inventory.libs=[] y stack.languages=[informix-4gl])"
      }
    },
    "summary_points": [
      {
        "point": "AF009 (proyecto safre_af) es la aplicación Informix 4GL de devolución de pagos en exceso del dominio AFORE/pensiones México: un pipeline batch con puntas interactivas de terminal que cubre lectura del archivo del instituto, carga/diagnóstico por saldos, liquidación RCV/VIVIENDA, generación del archivo de respuesta <AAAAMMDD>.DEV, reverso y consulta del control de proceso (dis_ctrl_proceso); la lógica crítica de diagnóstico y marcado de cuentas reside en la librería compartida EXCB136 incluida por EXCB102 y EXCB103.",
        "provenance": "inventory.app + inventory.stack + modules4gl.counts (libraries=1) + usecases.usecases (UC-EXC-001..008)"
      },
      {
        "point": "Alcance mediano con complejidad concentrada: 8.098 líneas totales (6.258 de código) en 9 programas + 4 forms, 94 funciones y 17 REPORTs; complejidad de 771 puntos con 5 módulos 'god' — EXCB103 (wmc 149, ncloc 1.292), EXCB102 (wmc 104, ncloc 1.250) y EXCB136 (wmc 116) — que concentran el riesgo de mantenimiento.",
        "provenance": "inventory.counts + quality.measures + quality.god_classes"
      },
      {
        "point": "Riesgo de seguridad HIGH confirmado y accionable: de 30 hallazgos SAST, 5 son HIGH confirmados — 1 inyección SQL real (EXCC001.Consulta: el WHERE digitado en CONSTRUCT se concatena directo al PREPARE) y 4 inyecciones de comandos shell (RUN nohup fglgo con r_sesion.sesion de ARG_VAL envuelto en comillas simples sin sanitizar, en EXCB001 x2, EXCB005 y EXCB007); otros 14 HIGH son latentes o de segundo orden (PREPARE concatenados y RUN con rutas de tablas de control).",
        "provenance": "sast.findings (severity=HIGH, status=confirmed: 4gl-sql-string-concat EXCC001 Consulta + 4gl-run-shell-with-input EXCB001 L326/L382, EXCB005 L347, EXCB007 L306)"
      },
      {
        "point": "Acoplamiento estructural que encarece mantenimiento y migración: 53 invocaciones a comandos del SO (sed/cut/dbload/cat/chmod/lp/nohup), 8 stored procedures de Informix (marca_cuenta, fn_saldo_dia_sie, fn_precio_dia, sp_sca_valida, entre otros), 3 bases de datos (safre_af, safre_seg, safre_tmp) y un shell externo NO versionado (/safre/est/shells/env_mail_gral.sh) invocado en 5 sitios para el envío de correos; el core 4GL no empaqueta dependencias terceras, por lo que el eje CVE-por-dependencia es N/A.",
        "provenance": "modules4gl.counts (shell_commands=53, stored_procedures=8) + inventory.stack.databases + sast.findings (4gl-shell-script-path, 5 sitios)"
      },
      {
        "point": "La seguridad aplicativa existente se sostiene en perfilamiento por privilegio y trazabilidad: SCA (Carga_Parametros_sca + sp_sca_valida) revalida sesión/privilegio/perfiles en cada COMMAND y captura con 15 privilegios catalogados (1796-1812, 3731-3734), y el manejo de errores es uniforme (STARTLOG en /safre/exc/logs + WHENEVER ERROR → sp_graba_logs_err en safre_seg); el escaneo de secrets en modo gitleaks no arrojó credenciales en el fuente (único hallazgo INFO: 3 correos corporativos hardcodeados en EXCB100).",
        "provenance": "functional.privileges (15) + br.rules (BR-EXC-017, BR-EXC-018) + sast.scans + sast.findings (email-address-in-source)"
      },
      {
        "point": "Recomendación central: cerrar primero los 5 HIGH confirmados con cambios puntuales de bajo esfuerzo (placeholders/EXECUTE USING y whitelist de sesión en los RUN) y evolucionar por estrangulamiento — encapsular el núcleo de diagnóstico/liquidación (EXCB136 + etapas batch de dis_ctrl_proceso) detrás de servicios — en lugar de un reemplazo big-bang que exigiría re-certificar el cálculo financiero (21 reglas de negocio, 8 SPs).",
        "provenance": "sast.findings (5 HIGH confirmados) + remediation (este fact) + br.rules (21) + modules4gl.counts.stored_procedures (8)"
      }
    ]
  },
  "remediation": [
    {
      "action": "Cerrar la inyección SQL de EXCC001.Consulta: construir el WHERE del query-by-example con validación por campo y escapado de comillas (o migrar el CONSTRUCT a filtros tipados por campo); nunca concatenar cla_where directo al PREPARE.",
      "impact": "alto",
      "effort": "bajo",
      "note": "Único hallazgo donde el usuario final controla la sintaxis del SQL ejecutado (captura de pantalla → PREPARE sin placeholders).",
      "provenance": "sast.findings — 4gl-sql-string-concat, EXCC001.4gl L152/185/189 (FUNCTION Consulta), status=confirmed"
    },
    {
      "action": "Sanitizar los argumentos que alimentan los RUN de lanzamiento batch: validar r_sesion.sesion y r_sesion.modulo contra whitelist [A-Za-z0-9_-] antes de cada 'nohup fglgo ...' (EXCB001 L326 y L382, EXCB005 L347, EXCB007 L306).",
      "impact": "alto",
      "effort": "bajo",
      "note": "4 puntos de inyección de comandos confirmados; el folio digitado ya está mitigado por validación dígito-a-dígito en EXCB001.",
      "provenance": "sast.findings — 4gl-run-shell-with-input, EXCB001.4gl L326-331 y L382-388, EXCB005.4gl L347-352, EXCB007.4gl L306-311 (status=confirmed)"
    },
    {
      "action": "Parametrizar los PREPARE dinámicos restantes con '?' + EXECUTE USING en EXCB102 (L182, L197, L364, L381, L400, L414), EXCB103 (L301, L317) y EXCB106 (L151, L277, L293).",
      "impact": "medio",
      "effort": "medio",
      "note": "11 hallazgos HIGH latentes: vectores de segundo orden vía valores de dis_ctrl_proceso/seg_modulo o coerción INTEGER; defensa en profundidad de bajo costo unitario.",
      "provenance": "sast.findings — 4gl-sql-string-concat en EXCB102/EXCB103/EXCB106, status=latent"
    },
    {
      "action": "Endurecer la ejecución shell de segundo orden: restringir seg_modulo.ruta_rescate/ruta_listados y dis_ctrl_proceso.parametro1/parametro2 a rutas/patrones validados al consumirse en RUN (ls/rm/sed/touch/cat/lp), y auditar quién puede escribir esas tablas de control.",
      "impact": "medio",
      "effort": "medio",
      "note": "Explota solo si un administrador/tabla comprometida controla el valor; hoy el flujo es interno.",
      "provenance": "sast.findings — 4gl-run-shell-with-input, EXCB001.4gl L217-244, EXCB102.4gl sed/touch/cd/rm/cat (consolidado 7+ sitios), EXCC001.4gl L321-322 (status=latent)"
    },
    {
      "action": "Sustituir el 'chmod 777' por permisos de grupo restrictivos en los archivos de salida de EXCB103 (6 sitios) y fijar ownership del directorio de envío del archivo .DEV.",
      "impact": "medio",
      "effort": "bajo",
      "note": "Salidas world-writable: cualquier usuario del host puede alterar el archivo de respuesta al instituto.",
      "provenance": "sast.findings — 4gl-shell-world-permissions, EXCB103.4gl L274/275/358/497/953/1064 (status=confirmed)"
    },
    {
      "action": "Traer al repositorio y revisar el shell externo /safre/est/shells/env_mail_gral.sh (5 sitios de invocación): versionarlo, eliminar la dependencia de ruta absoluta y validar sus argumentos (asunto/archivo/ruta/programa).",
      "impact": "medio",
      "effort": "bajo",
      "note": "Script no versionado en el fuente, fuera del alcance de este análisis SAST: superficie ciega.",
      "provenance": "sast.findings — 4gl-shell-script-path, EXCB100.4gl L409/416, EXCB102.4gl L1379, EXCB103.4gl L1077, EXCB106.4gl L533 (status=confirmed)"
    },
    {
      "action": "Refactorizar los módulos god (EXCB103 wmc=149, EXCB102 wmc=104, EXCB136 wmc=116) extrayendo funciones por etapa del proceso (carga/separación/diagnóstico/respuesta), como prerrequisito de mantenibilidad y de cualquier opción de migración.",
      "impact": "medio (deuda técnica)",
      "effort": "alto",